{
  "schemaVersion": "0.1.0",
  "schemaName": "BioactivityPoDHandoffPacket",
  "handoffId": "b2c3d4e5-f6a7-8901-bcde-f23456789012",
  "sourcePacketRef": "a1b2c3d4-e5f6-7890-abcd-ef1234567890",
  "qualifiedFeatures": [
    {
      "featureId": "cg_accepted_002",
      "status": "accepted_for_pod",
      "warnings": [],
      "mappedGeneIds": [],
      "mappingConfidence": "none",
      "mappingMethod": "unknown",
      "explainability": {
        "ruleCode": "RULE_010_ACCEPTED",
        "reasonTemplate": "Feature cg_accepted_002 satisfies all policy thresholds and carries no blocking warnings. Accepted for downstream Bioactivity-PoD modelling.",
        "reviewRequired": false,
        "policyReference": "none"
      }
    }
  ],
  "excludedFeatures": [
    {
      "featureId": "cg_excluded_001",
      "status": "excluded_qc_failure",
      "warnings": [
        {
          "warningCode": "EPIE002_EXCESSIVE_MISSINGNESS",
          "severity": "error",
          "message": "Feature cg_excluded_001 has 25.0% missing values (threshold 20.0%)",
          "category": "platform_specific",
          "featureIds": [
            "cg_excluded_001"
          ],
          "blocksDownstream": true
        }
      ],
      "mappedGeneIds": [],
      "mappingConfidence": "none",
      "mappingMethod": "unknown",
      "explainability": {
        "ruleCode": "RULE_005_HIGH_MISSINGNESS",
        "reasonTemplate": "Feature cg_excluded_001 has 25.0% missing values, exceeding the policy exclusion threshold of 20.0%. High missingness reduces reliability for dose-response modelling.",
        "remediationHint": "Investigate sample-level missingness; consider imputation or exclusion of low-quality samples.",
        "reviewRequired": true,
        "policyReference": "missingness.exclusionThreshold",
        "thresholdValue": "20.0%",
        "observedValue": "25.0%"
      }
    }
  ],
  "doseResponseReadySubset": [
    "cg_accepted_002"
  ],
  "mandatoryCaveats": [
    {
      "warningCode": "EPIE002_EXCESSIVE_MISSINGNESS",
      "severity": "error",
      "message": "Feature cg_excluded_001 has 25.0% missing values (threshold 20.0%)",
      "category": "platform_specific",
      "featureIds": [
        "cg_excluded_001"
      ],
      "blocksDownstream": true
    }
  ],
  "generatedAt": "2026-05-05T00:00:00Z",
  "persistenceStatus": "not_assessed",
  "reversibilityStatus": "not_assessed",
  "heritabilityClaim": "none",
  "provenance": {
    "datasetId": "golden-excluded-ds-001",
    "upstreamSteps": [
      {
        "stepName": "normalisation",
        "toolName": "minfi",
        "toolVersion": "1.44.0",
        "parameters": {
          "method": "SWAN"
        },
        "timestamp": "2026-04-01T11:00:00Z",
        "inputFiles": [
          "intensities.rds"
        ],
        "outputFiles": [
          "beta_values.csv"
        ]
      }
    ],
    "normalisationMethod": "SWAN",
    "probeManifestVersion": "Illumina EPIC v2.0",
    "annotationVersion": "hg38"
  }
}
