{
  "schemaVersion": "0.1.0",
  "schemaName": "BioactivityPoDHandoffPacket",
  "handoffId": "b2c3d4e5-f6a7-8901-bcde-f23456789012",
  "sourcePacketRef": "a1b2c3d4-e5f6-7890-abcd-ef1234567890",
  "qualifiedFeatures": [
    {
      "featureId": "cg_accepted_001",
      "status": "accepted_for_pod",
      "warnings": [],
      "mappedGeneIds": [],
      "mappingConfidence": "none",
      "mappingMethod": "unknown",
      "explainability": {
        "ruleCode": "RULE_010_ACCEPTED",
        "reasonTemplate": "Feature cg_accepted_001 satisfies all policy thresholds and carries no blocking warnings. Accepted for downstream Bioactivity-PoD modelling.",
        "reviewRequired": false,
        "policyReference": "none"
      }
    },
    {
      "featureId": "cg_accepted_002",
      "status": "accepted_for_pod",
      "warnings": [],
      "mappedGeneIds": [],
      "mappingConfidence": "none",
      "mappingMethod": "unknown",
      "explainability": {
        "ruleCode": "RULE_010_ACCEPTED",
        "reasonTemplate": "Feature cg_accepted_002 satisfies all policy thresholds and carries no blocking warnings. Accepted for downstream Bioactivity-PoD modelling.",
        "reviewRequired": false,
        "policyReference": "none"
      }
    }
  ],
  "excludedFeatures": [],
  "doseResponseReadySubset": [
    "cg_accepted_001",
    "cg_accepted_002"
  ],
  "mandatoryCaveats": [],
  "generatedAt": "2026-05-05T00:00:00Z",
  "persistenceStatus": "not_assessed",
  "reversibilityStatus": "not_assessed",
  "heritabilityClaim": "none",
  "provenance": {
    "datasetId": "golden-accepted-ds-001",
    "upstreamSteps": [
      {
        "stepName": "idat_to_intensities",
        "toolName": "minfi",
        "toolVersion": "1.44.0",
        "parameters": {
          "preprocessMethod": "noob"
        },
        "timestamp": "2026-04-01T10:00:00Z",
        "inputFiles": [
          "sample_001.idat",
          "sample_002.idat"
        ],
        "outputFiles": [
          "intensities.rds"
        ]
      },
      {
        "stepName": "normalisation",
        "toolName": "minfi",
        "toolVersion": "1.44.0",
        "parameters": {
          "method": "SWAN"
        },
        "timestamp": "2026-04-01T11:00:00Z",
        "inputFiles": [
          "intensities.rds"
        ],
        "outputFiles": [
          "beta_values.csv"
        ]
      }
    ],
    "normalisationMethod": "SWAN",
    "batchCorrectionMethod": "ComBat",
    "probeManifestVersion": "Illumina EPIC v2.0",
    "annotationVersion": "hg38"
  }
}
